
*** Running vivado
    with args -log tp_fsm.vdi -applog -m64 -product Vivado -messageDb vivado.pb -mode batch -source tp_fsm.tcl -notrace



****** Vivado v2020.2 (64-bit)
  **** SW Build 3064766 on Wed Nov 18 09:12:45 MST 2020
  **** IP Build 3064653 on Wed Nov 18 14:17:31 MST 2020
    ** Copyright 1986-2020 Xilinx, Inc. All Rights Reserved.

source tp_fsm.tcl -notrace
Command: link_design -top tp_fsm -part xc7z010clg400-1
Design is defaulting to srcset: sources_1
Design is defaulting to constrset: constrs_1
INFO: [Device 21-403] Loading part xc7z010clg400-1
Netlist sorting complete. Time (s): cpu = 00:00:00 ; elapsed = 00:00:00.001 . Memory (MB): peak = 1143.867 ; gain = 0.000
INFO: [Netlist 29-17] Analyzing 7 Unisim elements for replacement
INFO: [Netlist 29-28] Unisim Transformation completed in 0 CPU seconds
INFO: [Project 1-479] Netlist was created with Vivado 2020.2
INFO: [Project 1-570] Preparing netlist for logic optimization
Parsing XDC File [C:/Users/utilisateur/Desktop/LTspice/Porte logique/CoursFPGA/TP3_FSM/Cora-Z7-10-Master.xdc]
Finished Parsing XDC File [C:/Users/utilisateur/Desktop/LTspice/Porte logique/CoursFPGA/TP3_FSM/Cora-Z7-10-Master.xdc]
INFO: [Opt 31-138] Pushed 0 inverter(s) to 0 load pin(s).
Netlist sorting complete. Time (s): cpu = 00:00:00 ; elapsed = 00:00:00 . Memory (MB): peak = 1143.867 ; gain = 0.000
INFO: [Project 1-111] Unisim Transformation Summary:
No Unisim elements were transformed.

7 Infos, 0 Warnings, 0 Critical Warnings and 0 Errors encountered.
link_design completed successfully
link_design: Time (s): cpu = 00:00:07 ; elapsed = 00:00:09 . Memory (MB): peak = 1143.867 ; gain = 0.000
Command: opt_design
Attempting to get a license for feature 'Implementation' and/or device 'xc7z010'
INFO: [Common 17-349] Got license for feature 'Implementation' and/or device 'xc7z010'
Running DRC as a precondition to command opt_design

Starting DRC Task
INFO: [DRC 23-27] Running DRC with 2 threads
WARNING: [DRC RPBF-3] IO port buffering is incomplete: Device port end_counter_cycle expects both input and output buffering but the buffers are incomplete.
INFO: [Project 1-461] DRC finished with 0 Errors, 1 Warnings
INFO: [Project 1-462] Please refer to the DRC report (report_drc) for more information.

Time (s): cpu = 00:00:02 ; elapsed = 00:00:01 . Memory (MB): peak = 1143.867 ; gain = 0.000

Starting Cache Timing Information Task
INFO: [Timing 38-35] Done setting XDC timing constraints.
Ending Cache Timing Information Task | Checksum: 2bbe4723d

Time (s): cpu = 00:00:08 ; elapsed = 00:00:08 . Memory (MB): peak = 1559.563 ; gain = 415.695

Starting Logic Optimization Task

Phase 1 Retarget
INFO: [Opt 31-138] Pushed 0 inverter(s) to 0 load pin(s).
INFO: [Opt 31-49] Retargeted 0 cell(s).
Phase 1 Retarget | Checksum: 2bbe4723d

Time (s): cpu = 00:00:00 ; elapsed = 00:00:00.011 . Memory (MB): peak = 1765.289 ; gain = 0.000
INFO: [Opt 31-389] Phase Retarget created 0 cells and removed 0 cells

Phase 2 Constant propagation
INFO: [Opt 31-138] Pushed 0 inverter(s) to 0 load pin(s).
Phase 2 Constant propagation | Checksum: 2bbe4723d

Time (s): cpu = 00:00:00 ; elapsed = 00:00:00.012 . Memory (MB): peak = 1765.289 ; gain = 0.000
INFO: [Opt 31-389] Phase Constant propagation created 0 cells and removed 0 cells

Phase 3 Sweep
Phase 3 Sweep | Checksum: 284e6a31f

Time (s): cpu = 00:00:00 ; elapsed = 00:00:00.015 . Memory (MB): peak = 1765.289 ; gain = 0.000
INFO: [Opt 31-389] Phase Sweep created 0 cells and removed 0 cells

Phase 4 BUFG optimization
Phase 4 BUFG optimization | Checksum: 284e6a31f

Time (s): cpu = 00:00:00 ; elapsed = 00:00:00.017 . Memory (MB): peak = 1765.289 ; gain = 0.000
INFO: [Opt 31-662] Phase BUFG optimization created 0 cells of which 0 are BUFGs and removed 0 cells.

Phase 5 Shift Register Optimization
INFO: [Opt 31-1064] SRL Remap converted 0 SRLs to 0 registers and converted 0 registers of register chains to 0 SRLs
Phase 5 Shift Register Optimization | Checksum: 284e6a31f

Time (s): cpu = 00:00:00 ; elapsed = 00:00:00.018 . Memory (MB): peak = 1765.289 ; gain = 0.000
INFO: [Opt 31-389] Phase Shift Register Optimization created 0 cells and removed 0 cells

Phase 6 Post Processing Netlist
Phase 6 Post Processing Netlist | Checksum: 284e6a31f

Time (s): cpu = 00:00:00 ; elapsed = 00:00:00.019 . Memory (MB): peak = 1765.289 ; gain = 0.000
INFO: [Opt 31-389] Phase Post Processing Netlist created 0 cells and removed 0 cells
Opt_design Change Summary
=========================


-------------------------------------------------------------------------------------------------------------------------
|  Phase                        |  #Cells created  |  #Cells Removed  |  #Constrained objects preventing optimizations  |
-------------------------------------------------------------------------------------------------------------------------
|  Retarget                     |               0  |               0  |                                              0  |
|  Constant propagation         |               0  |               0  |                                              0  |
|  Sweep                        |               0  |               0  |                                              0  |
|  BUFG optimization            |               0  |               0  |                                              0  |
|  Shift Register Optimization  |               0  |               0  |                                              0  |
|  Post Processing Netlist      |               0  |               0  |                                              0  |
-------------------------------------------------------------------------------------------------------------------------



Starting Connectivity Check Task

Time (s): cpu = 00:00:00 ; elapsed = 00:00:00 . Memory (MB): peak = 1765.289 ; gain = 0.000
Ending Logic Optimization Task | Checksum: 20abbb431

Time (s): cpu = 00:00:00 ; elapsed = 00:00:00.025 . Memory (MB): peak = 1765.289 ; gain = 0.000

Starting Power Optimization Task
INFO: [Pwropt 34-132] Skipping clock gating for clocks with a period < 2.00 ns.
Ending Power Optimization Task | Checksum: 20abbb431

Time (s): cpu = 00:00:00 ; elapsed = 00:00:00.008 . Memory (MB): peak = 1765.289 ; gain = 0.000

Starting Final Cleanup Task
Ending Final Cleanup Task | Checksum: 20abbb431

Time (s): cpu = 00:00:00 ; elapsed = 00:00:00 . Memory (MB): peak = 1765.289 ; gain = 0.000

Starting Netlist Obfuscation Task
Netlist sorting complete. Time (s): cpu = 00:00:00 ; elapsed = 00:00:00 . Memory (MB): peak = 1765.289 ; gain = 0.000
Ending Netlist Obfuscation Task | Checksum: 20abbb431

Time (s): cpu = 00:00:00 ; elapsed = 00:00:00 . Memory (MB): peak = 1765.289 ; gain = 0.000
INFO: [Common 17-83] Releasing license: Implementation
24 Infos, 1 Warnings, 0 Critical Warnings and 0 Errors encountered.
opt_design completed successfully
opt_design: Time (s): cpu = 00:00:12 ; elapsed = 00:00:11 . Memory (MB): peak = 1765.289 ; gain = 621.422
INFO: [Timing 38-480] Writing timing data to binary archive.
Writing placer database...
Writing XDEF routing.
Writing XDEF routing logical nets.
Writing XDEF routing special nets.
Write XDEF Complete: Time (s): cpu = 00:00:00 ; elapsed = 00:00:00.044 . Memory (MB): peak = 1765.289 ; gain = 0.000
INFO: [Common 17-1381] The checkpoint 'C:/Users/utilisateur/Desktop/LTspice/Porte logique/CoursFPGA/TP3_FSM/FSM.runs/impl_1/tp_fsm_opt.dcp' has been generated.
INFO: [runtcl-4] Executing : report_drc -file tp_fsm_drc_opted.rpt -pb tp_fsm_drc_opted.pb -rpx tp_fsm_drc_opted.rpx
Command: report_drc -file tp_fsm_drc_opted.rpt -pb tp_fsm_drc_opted.pb -rpx tp_fsm_drc_opted.rpx
INFO: [IP_Flow 19-234] Refreshing IP repositories
INFO: [IP_Flow 19-1704] No user IP repositories specified
INFO: [IP_Flow 19-2313] Loaded Vivado IP repository 'E:/Vivado/2020.2/data/ip'.
INFO: [Timing 38-35] Done setting XDC timing constraints.
INFO: [DRC 23-27] Running DRC with 2 threads
INFO: [Coretcl 2-168] The results of DRC are in file C:/Users/utilisateur/Desktop/LTspice/Porte logique/CoursFPGA/TP3_FSM/FSM.runs/impl_1/tp_fsm_drc_opted.rpt.
report_drc completed successfully
Command: place_design
Attempting to get a license for feature 'Implementation' and/or device 'xc7z010'
INFO: [Common 17-349] Got license for feature 'Implementation' and/or device 'xc7z010'
INFO: [DRC 23-27] Running DRC with 2 threads
INFO: [Vivado_Tcl 4-198] DRC finished with 0 Errors
INFO: [Vivado_Tcl 4-199] Please refer to the DRC report (report_drc) for more information.
Running DRC as a precondition to command place_design
INFO: [DRC 23-27] Running DRC with 2 threads
WARNING: [DRC RPBF-3] IO port buffering is incomplete: Device port end_counter_cycle expects both input and output buffering but the buffers are incomplete.
INFO: [Vivado_Tcl 4-198] DRC finished with 0 Errors, 1 Warnings
INFO: [Vivado_Tcl 4-199] Please refer to the DRC report (report_drc) for more information.

Starting Placer Task
INFO: [Place 30-611] Multithreading enabled for place_design using a maximum of 2 CPUs

Phase 1 Placer Initialization

Phase 1.1 Placer Initialization Netlist Sorting
Netlist sorting complete. Time (s): cpu = 00:00:00 ; elapsed = 00:00:00 . Memory (MB): peak = 1814.238 ; gain = 0.000
Phase 1.1 Placer Initialization Netlist Sorting | Checksum: 13082ce68

Time (s): cpu = 00:00:00 ; elapsed = 00:00:00.006 . Memory (MB): peak = 1814.238 ; gain = 0.000
Netlist sorting complete. Time (s): cpu = 00:00:00 ; elapsed = 00:00:00 . Memory (MB): peak = 1814.238 ; gain = 0.000

Phase 1.2 IO Placement/ Clock Placement/ Build Placer Device
Phase 1.2 IO Placement/ Clock Placement/ Build Placer Device | Checksum: 11b796030

Time (s): cpu = 00:00:00 ; elapsed = 00:00:00.120 . Memory (MB): peak = 1814.238 ; gain = 0.000

Phase 1.3 Build Placer Netlist Model
Phase 1.3 Build Placer Netlist Model | Checksum: 1331d39a1

Time (s): cpu = 00:00:01 ; elapsed = 00:00:00.213 . Memory (MB): peak = 1814.238 ; gain = 0.000

Phase 1.4 Constrain Clocks/Macros
Phase 1.4 Constrain Clocks/Macros | Checksum: 1331d39a1

Time (s): cpu = 00:00:01 ; elapsed = 00:00:00.216 . Memory (MB): peak = 1814.238 ; gain = 0.000
Phase 1 Placer Initialization | Checksum: 1331d39a1

Time (s): cpu = 00:00:01 ; elapsed = 00:00:00.218 . Memory (MB): peak = 1814.238 ; gain = 0.000

Phase 2 Global Placement

Phase 2.1 Floorplanning
Phase 2.1 Floorplanning | Checksum: 179a8eb48

Time (s): cpu = 00:00:01 ; elapsed = 00:00:00.324 . Memory (MB): peak = 1814.238 ; gain = 0.000

Phase 2.2 Update Timing before SLR Path Opt
Phase 2.2 Update Timing before SLR Path Opt | Checksum: 162479cd4

Time (s): cpu = 00:00:01 ; elapsed = 00:00:00.371 . Memory (MB): peak = 1814.238 ; gain = 0.000

Phase 2.3 Global Placement Core

Phase 2.3.1 Physical Synthesis In Placer
INFO: [Physopt 32-1035] Found 0 LUTNM shape to break, 2 LUT instances to create LUTNM shape
INFO: [Physopt 32-1044] Break lutnm for timing: one critical 0, two critical 0, total 0, new lutff created 0
INFO: [Physopt 32-775] End 1 Pass. Optimized 1 net or cell. Created 0 new cell, deleted 1 existing cell and moved 0 existing cell
INFO: [Physopt 32-65] No nets found for high-fanout optimization.
INFO: [Physopt 32-232] Optimized 0 net. Created 0 new instance.
INFO: [Physopt 32-775] End 1 Pass. Optimized 0 net or cell. Created 0 new cell, deleted 0 existing cell and moved 0 existing cell
INFO: [Physopt 32-670] No setup violation found.  DSP Register Optimization was not performed.
INFO: [Physopt 32-670] No setup violation found.  Shift Register to Pipeline Optimization was not performed.
INFO: [Physopt 32-670] No setup violation found.  Shift Register Optimization was not performed.
INFO: [Physopt 32-670] No setup violation found.  BRAM Register Optimization was not performed.
INFO: [Physopt 32-670] No setup violation found.  URAM Register Optimization was not performed.
INFO: [Physopt 32-949] No candidate nets found for dynamic/static region interface net replication
INFO: [Physopt 32-775] End 1 Pass. Optimized 0 net or cell. Created 0 new cell, deleted 0 existing cell and moved 0 existing cell
Netlist sorting complete. Time (s): cpu = 00:00:00 ; elapsed = 00:00:00.001 . Memory (MB): peak = 1814.238 ; gain = 0.000

Summary of Physical Synthesis Optimizations
============================================


-----------------------------------------------------------------------------------------------------------------------------------------------------------
|  Optimization                                     |  Added Cells  |  Removed Cells  |  Optimized Cells/Nets  |  Dont Touch  |  Iterations  |  Elapsed   |
-----------------------------------------------------------------------------------------------------------------------------------------------------------
|  LUT Combining                                    |            0  |              1  |                     1  |           0  |           1  |  00:00:00  |
|  Very High Fanout                                 |            0  |              0  |                     0  |           0  |           1  |  00:00:00  |
|  DSP Register                                     |            0  |              0  |                     0  |           0  |           0  |  00:00:00  |
|  Shift Register to Pipeline                       |            0  |              0  |                     0  |           0  |           0  |  00:00:00  |
|  Shift Register                                   |            0  |              0  |                     0  |           0  |           0  |  00:00:00  |
|  BRAM Register                                    |            0  |              0  |                     0  |           0  |           0  |  00:00:00  |
|  URAM Register                                    |            0  |              0  |                     0  |           0  |           0  |  00:00:00  |
|  Dynamic/Static Region Interface Net Replication  |            0  |              0  |                     0  |           0  |           1  |  00:00:00  |
|  Total                                            |            0  |              1  |                     1  |           0  |           3  |  00:00:00  |
-----------------------------------------------------------------------------------------------------------------------------------------------------------


Phase 2.3.1 Physical Synthesis In Placer | Checksum: 172f95ee6

Time (s): cpu = 00:00:02 ; elapsed = 00:00:00.972 . Memory (MB): peak = 1814.238 ; gain = 0.000
Phase 2.3 Global Placement Core | Checksum: 17a9265eb

Time (s): cpu = 00:00:02 ; elapsed = 00:00:00.988 . Memory (MB): peak = 1814.238 ; gain = 0.000
Phase 2 Global Placement | Checksum: 17a9265eb

Time (s): cpu = 00:00:02 ; elapsed = 00:00:00.989 . Memory (MB): peak = 1814.238 ; gain = 0.000

Phase 3 Detail Placement

Phase 3.1 Commit Multi Column Macros
Phase 3.1 Commit Multi Column Macros | Checksum: 14ce88961

Time (s): cpu = 00:00:02 ; elapsed = 00:00:01 . Memory (MB): peak = 1814.238 ; gain = 0.000

Phase 3.2 Commit Most Macros & LUTRAMs
Phase 3.2 Commit Most Macros & LUTRAMs | Checksum: 23277b39d

Time (s): cpu = 00:00:02 ; elapsed = 00:00:01 . Memory (MB): peak = 1814.238 ; gain = 0.000

Phase 3.3 Area Swap Optimization
Phase 3.3 Area Swap Optimization | Checksum: 22bc959ae

Time (s): cpu = 00:00:02 ; elapsed = 00:00:01 . Memory (MB): peak = 1814.238 ; gain = 0.000

Phase 3.4 Pipeline Register Optimization
Phase 3.4 Pipeline Register Optimization | Checksum: 24853cd51

Time (s): cpu = 00:00:02 ; elapsed = 00:00:01 . Memory (MB): peak = 1814.238 ; gain = 0.000

Phase 3.5 Small Shape Detail Placement
Phase 3.5 Small Shape Detail Placement | Checksum: 1f6ad4a6a

Time (s): cpu = 00:00:02 ; elapsed = 00:00:01 . Memory (MB): peak = 1814.238 ; gain = 0.000

Phase 3.6 Re-assign LUT pins
Phase 3.6 Re-assign LUT pins | Checksum: 201c0a0b7

Time (s): cpu = 00:00:02 ; elapsed = 00:00:01 . Memory (MB): peak = 1814.238 ; gain = 0.000

Phase 3.7 Pipeline Register Optimization
Phase 3.7 Pipeline Register Optimization | Checksum: 19a3a2c58

Time (s): cpu = 00:00:02 ; elapsed = 00:00:01 . Memory (MB): peak = 1814.238 ; gain = 0.000
Phase 3 Detail Placement | Checksum: 19a3a2c58

Time (s): cpu = 00:00:02 ; elapsed = 00:00:01 . Memory (MB): peak = 1814.238 ; gain = 0.000

Phase 4 Post Placement Optimization and Clean-Up

Phase 4.1 Post Commit Optimization
INFO: [Timing 38-35] Done setting XDC timing constraints.

Phase 4.1.1 Post Placement Optimization
Post Placement Optimization Initialization | Checksum: 14a2749a0

Phase 4.1.1.1 BUFG Insertion

Starting Physical Synthesis Task

Phase 1 Physical Synthesis Initialization
INFO: [Physopt 32-721] Multithreading enabled for phys_opt_design using a maximum of 2 CPUs
INFO: [Physopt 32-619] Estimated Timing Summary | WNS=5.137 | TNS=0.000 |
Phase 1 Physical Synthesis Initialization | Checksum: 18e71b12d

Time (s): cpu = 00:00:00 ; elapsed = 00:00:00.010 . Memory (MB): peak = 1814.238 ; gain = 0.000
INFO: [Place 46-56] BUFG insertion identified 0 candidate nets. Inserted BUFG: 0, Replicated BUFG Driver: 0, Skipped due to Placement/Routing Conflicts: 0, Skipped due to Timing Degradation: 0, Skipped due to Illegal Netlist: 0.
Ending Physical Synthesis Task | Checksum: 1fbfec9f3

Time (s): cpu = 00:00:00 ; elapsed = 00:00:00.011 . Memory (MB): peak = 1814.238 ; gain = 0.000
Phase 4.1.1.1 BUFG Insertion | Checksum: 14a2749a0

Time (s): cpu = 00:00:02 ; elapsed = 00:00:01 . Memory (MB): peak = 1814.238 ; gain = 0.000
INFO: [Place 30-746] Post Placement Timing Summary WNS=5.137. For the most accurate timing information please run report_timing.

Time (s): cpu = 00:00:02 ; elapsed = 00:00:01 . Memory (MB): peak = 1814.238 ; gain = 0.000
Phase 4.1 Post Commit Optimization | Checksum: 1d3f946d3

Time (s): cpu = 00:00:02 ; elapsed = 00:00:01 . Memory (MB): peak = 1814.238 ; gain = 0.000

Phase 4.2 Post Placement Cleanup
Phase 4.2 Post Placement Cleanup | Checksum: 1d3f946d3

Time (s): cpu = 00:00:02 ; elapsed = 00:00:01 . Memory (MB): peak = 1814.238 ; gain = 0.000

Phase 4.3 Placer Reporting

Phase 4.3.1 Print Estimated Congestion
INFO: [Place 30-612] Post-Placement Estimated Congestion 
 ____________________________________________________
|           | Global Congestion | Short Congestion  |
| Direction | Region Size       | Region Size       |
|___________|___________________|___________________|
|      North|                1x1|                1x1|
|___________|___________________|___________________|
|      South|                1x1|                1x1|
|___________|___________________|___________________|
|       East|                1x1|                1x1|
|___________|___________________|___________________|
|       West|                1x1|                1x1|
|___________|___________________|___________________|

Phase 4.3.1 Print Estimated Congestion | Checksum: 1d3f946d3

Time (s): cpu = 00:00:02 ; elapsed = 00:00:01 . Memory (MB): peak = 1814.238 ; gain = 0.000
Phase 4.3 Placer Reporting | Checksum: 1d3f946d3

Time (s): cpu = 00:00:02 ; elapsed = 00:00:01 . Memory (MB): peak = 1814.238 ; gain = 0.000

Phase 4.4 Final Placement Cleanup
Netlist sorting complete. Time (s): cpu = 00:00:00 ; elapsed = 00:00:00 . Memory (MB): peak = 1814.238 ; gain = 0.000

Time (s): cpu = 00:00:02 ; elapsed = 00:00:01 . Memory (MB): peak = 1814.238 ; gain = 0.000
Phase 4 Post Placement Optimization and Clean-Up | Checksum: 1d5ea94bb

Time (s): cpu = 00:00:02 ; elapsed = 00:00:01 . Memory (MB): peak = 1814.238 ; gain = 0.000
Ending Placer Task | Checksum: 123b73212

Time (s): cpu = 00:00:02 ; elapsed = 00:00:01 . Memory (MB): peak = 1814.238 ; gain = 0.000
INFO: [Common 17-83] Releasing license: Implementation
61 Infos, 2 Warnings, 0 Critical Warnings and 0 Errors encountered.
place_design completed successfully
INFO: [Timing 38-480] Writing timing data to binary archive.
Writing placer database...
Writing XDEF routing.
Writing XDEF routing logical nets.
Writing XDEF routing special nets.
Write XDEF Complete: Time (s): cpu = 00:00:00 ; elapsed = 00:00:00.049 . Memory (MB): peak = 1814.238 ; gain = 0.000
INFO: [Common 17-1381] The checkpoint 'C:/Users/utilisateur/Desktop/LTspice/Porte logique/CoursFPGA/TP3_FSM/FSM.runs/impl_1/tp_fsm_placed.dcp' has been generated.
INFO: [runtcl-4] Executing : report_io -file tp_fsm_io_placed.rpt
report_io: Time (s): cpu = 00:00:00 ; elapsed = 00:00:00.037 . Memory (MB): peak = 1814.238 ; gain = 0.000
INFO: [runtcl-4] Executing : report_utilization -file tp_fsm_utilization_placed.rpt -pb tp_fsm_utilization_placed.pb
INFO: [runtcl-4] Executing : report_control_sets -verbose -file tp_fsm_control_sets_placed.rpt
report_control_sets: Time (s): cpu = 00:00:00 ; elapsed = 00:00:00.001 . Memory (MB): peak = 1814.238 ; gain = 0.000
Command: phys_opt_design
Attempting to get a license for feature 'Implementation' and/or device 'xc7z010'
INFO: [Common 17-349] Got license for feature 'Implementation' and/or device 'xc7z010'
INFO: [Vivado_Tcl 4-383] Design worst setup slack (WNS) is greater than or equal to 0.000 ns. Skipping all physical synthesis optimizations.
INFO: [Vivado_Tcl 4-232] No setup violation found. The netlist was not modified.
INFO: [Common 17-83] Releasing license: Implementation
70 Infos, 2 Warnings, 0 Critical Warnings and 0 Errors encountered.
phys_opt_design completed successfully
INFO: [Timing 38-480] Writing timing data to binary archive.
Writing placer database...
Writing XDEF routing.
Writing XDEF routing logical nets.
Writing XDEF routing special nets.
Write XDEF Complete: Time (s): cpu = 00:00:01 ; elapsed = 00:00:00.053 . Memory (MB): peak = 1814.238 ; gain = 0.000
INFO: [Common 17-1381] The checkpoint 'C:/Users/utilisateur/Desktop/LTspice/Porte logique/CoursFPGA/TP3_FSM/FSM.runs/impl_1/tp_fsm_physopt.dcp' has been generated.
Command: route_design
Attempting to get a license for feature 'Implementation' and/or device 'xc7z010'
INFO: [Common 17-349] Got license for feature 'Implementation' and/or device 'xc7z010'
Running DRC as a precondition to command route_design
INFO: [DRC 23-27] Running DRC with 2 threads
INFO: [Vivado_Tcl 4-198] DRC finished with 0 Errors
INFO: [Vivado_Tcl 4-199] Please refer to the DRC report (report_drc) for more information.


Starting Routing Task
INFO: [Route 35-254] Multithreading enabled for route_design using a maximum of 2 CPUs
Checksum: PlaceDB: 95ee7e3c ConstDB: 0 ShapeSum: 8dc8b3d6 RouteDB: 0

Phase 1 Build RT Design
Phase 1 Build RT Design | Checksum: 99cb2326

Time (s): cpu = 00:00:12 ; elapsed = 00:00:10 . Memory (MB): peak = 1857.813 ; gain = 38.379
Post Restoration Checksum: NetGraph: 86fd27b3 NumContArr: 12cdfb73 Constraints: 0 Timing: 0

Phase 2 Router Initialization

Phase 2.1 Create Timer
Phase 2.1 Create Timer | Checksum: 99cb2326

Time (s): cpu = 00:00:12 ; elapsed = 00:00:10 . Memory (MB): peak = 1857.813 ; gain = 38.379

Phase 2.2 Fix Topology Constraints
Phase 2.2 Fix Topology Constraints | Checksum: 99cb2326

Time (s): cpu = 00:00:12 ; elapsed = 00:00:10 . Memory (MB): peak = 1863.801 ; gain = 44.367

Phase 2.3 Pre Route Cleanup
Phase 2.3 Pre Route Cleanup | Checksum: 99cb2326

Time (s): cpu = 00:00:12 ; elapsed = 00:00:10 . Memory (MB): peak = 1863.801 ; gain = 44.367
 Number of Nodes with overlaps = 0

Phase 2.4 Update Timing
Phase 2.4 Update Timing | Checksum: 117441dd8

Time (s): cpu = 00:00:12 ; elapsed = 00:00:11 . Memory (MB): peak = 1866.660 ; gain = 47.227
INFO: [Route 35-416] Intermediate Timing Summary | WNS=5.977  | TNS=0.000  | WHS=-0.041 | THS=-0.067 |

Phase 2 Router Initialization | Checksum: 14851b497

Time (s): cpu = 00:00:12 ; elapsed = 00:00:11 . Memory (MB): peak = 1866.660 ; gain = 47.227

Router Utilization Summary
  Global Vertical Routing Utilization    = 0.00323761 %
  Global Horizontal Routing Utilization  = 0.000459559 %
  Routable Net Status*
  *Does not include unroutable nets such as driverless and loadless.
  Run report_route_status for detailed report.
  Number of Failed Nets               = 56
    (Failed Nets is the sum of unrouted and partially routed nets)
  Number of Unrouted Nets             = 23
  Number of Partially Routed Nets     = 33
  Number of Node Overlaps             = 18


Phase 3 Initial Routing

Phase 3.1 Global Routing
Phase 3.1 Global Routing | Checksum: 14851b497

Time (s): cpu = 00:00:12 ; elapsed = 00:00:11 . Memory (MB): peak = 1868.457 ; gain = 49.023
Phase 3 Initial Routing | Checksum: e0f68b1c

Time (s): cpu = 00:00:12 ; elapsed = 00:00:11 . Memory (MB): peak = 1868.457 ; gain = 49.023

Phase 4 Rip-up And Reroute

Phase 4.1 Global Iteration 0
 Number of Nodes with overlaps = 4
 Number of Nodes with overlaps = 2
 Number of Nodes with overlaps = 0
INFO: [Route 35-416] Intermediate Timing Summary | WNS=4.695  | TNS=0.000  | WHS=N/A    | THS=N/A    |

Phase 4.1 Global Iteration 0 | Checksum: 1951d06fc

Time (s): cpu = 00:00:12 ; elapsed = 00:00:11 . Memory (MB): peak = 1868.457 ; gain = 49.023
Phase 4 Rip-up And Reroute | Checksum: 1951d06fc

Time (s): cpu = 00:00:12 ; elapsed = 00:00:11 . Memory (MB): peak = 1868.457 ; gain = 49.023

Phase 5 Delay and Skew Optimization

Phase 5.1 Delay CleanUp
Phase 5.1 Delay CleanUp | Checksum: 1951d06fc

Time (s): cpu = 00:00:12 ; elapsed = 00:00:11 . Memory (MB): peak = 1868.457 ; gain = 49.023

Phase 5.2 Clock Skew Optimization
Phase 5.2 Clock Skew Optimization | Checksum: 1951d06fc

Time (s): cpu = 00:00:12 ; elapsed = 00:00:11 . Memory (MB): peak = 1868.457 ; gain = 49.023
Phase 5 Delay and Skew Optimization | Checksum: 1951d06fc

Time (s): cpu = 00:00:12 ; elapsed = 00:00:11 . Memory (MB): peak = 1868.457 ; gain = 49.023

Phase 6 Post Hold Fix

Phase 6.1 Hold Fix Iter

Phase 6.1.1 Update Timing
Phase 6.1.1 Update Timing | Checksum: 11110d6f5

Time (s): cpu = 00:00:12 ; elapsed = 00:00:11 . Memory (MB): peak = 1868.457 ; gain = 49.023
INFO: [Route 35-416] Intermediate Timing Summary | WNS=4.848  | TNS=0.000  | WHS=0.230  | THS=0.000  |

Phase 6.1 Hold Fix Iter | Checksum: 11110d6f5

Time (s): cpu = 00:00:12 ; elapsed = 00:00:11 . Memory (MB): peak = 1868.457 ; gain = 49.023
Phase 6 Post Hold Fix | Checksum: 11110d6f5

Time (s): cpu = 00:00:12 ; elapsed = 00:00:11 . Memory (MB): peak = 1868.457 ; gain = 49.023

Phase 7 Route finalize

Router Utilization Summary
  Global Vertical Routing Utilization    = 0.0190034 %
  Global Horizontal Routing Utilization  = 0.00643382 %
  Routable Net Status*
  *Does not include unroutable nets such as driverless and loadless.
  Run report_route_status for detailed report.
  Number of Failed Nets               = 0
    (Failed Nets is the sum of unrouted and partially routed nets)
  Number of Unrouted Nets             = 0
  Number of Partially Routed Nets     = 0
  Number of Node Overlaps             = 0

Phase 7 Route finalize | Checksum: 1b4a06e05

Time (s): cpu = 00:00:12 ; elapsed = 00:00:11 . Memory (MB): peak = 1868.457 ; gain = 49.023

Phase 8 Verifying routed nets

 Verification completed successfully
Phase 8 Verifying routed nets | Checksum: 1b4a06e05

Time (s): cpu = 00:00:12 ; elapsed = 00:00:11 . Memory (MB): peak = 1869.441 ; gain = 50.008

Phase 9 Depositing Routes
Phase 9 Depositing Routes | Checksum: 2ae79765a

Time (s): cpu = 00:00:12 ; elapsed = 00:00:11 . Memory (MB): peak = 1869.441 ; gain = 50.008

Phase 10 Post Router Timing
INFO: [Route 35-57] Estimated Timing Summary | WNS=4.848  | TNS=0.000  | WHS=0.230  | THS=0.000  |

INFO: [Route 35-327] The final timing numbers are based on the router estimated timing analysis. For a complete and accurate timing signoff, please run report_timing_summary.
Phase 10 Post Router Timing | Checksum: 2ae79765a

Time (s): cpu = 00:00:12 ; elapsed = 00:00:11 . Memory (MB): peak = 1869.441 ; gain = 50.008
INFO: [Route 35-16] Router Completed Successfully

Time (s): cpu = 00:00:12 ; elapsed = 00:00:11 . Memory (MB): peak = 1869.441 ; gain = 50.008

Routing Is Done.
INFO: [Common 17-83] Releasing license: Implementation
84 Infos, 2 Warnings, 0 Critical Warnings and 0 Errors encountered.
route_design completed successfully
route_design: Time (s): cpu = 00:00:13 ; elapsed = 00:00:12 . Memory (MB): peak = 1869.441 ; gain = 55.203
INFO: [Timing 38-480] Writing timing data to binary archive.
Writing placer database...
Writing XDEF routing.
Writing XDEF routing logical nets.
Writing XDEF routing special nets.
Write XDEF Complete: Time (s): cpu = 00:00:00 ; elapsed = 00:00:00.055 . Memory (MB): peak = 1879.293 ; gain = 9.852
INFO: [Common 17-1381] The checkpoint 'C:/Users/utilisateur/Desktop/LTspice/Porte logique/CoursFPGA/TP3_FSM/FSM.runs/impl_1/tp_fsm_routed.dcp' has been generated.
INFO: [runtcl-4] Executing : report_drc -file tp_fsm_drc_routed.rpt -pb tp_fsm_drc_routed.pb -rpx tp_fsm_drc_routed.rpx
Command: report_drc -file tp_fsm_drc_routed.rpt -pb tp_fsm_drc_routed.pb -rpx tp_fsm_drc_routed.rpx
INFO: [IP_Flow 19-1839] IP Catalog is up to date.
INFO: [DRC 23-27] Running DRC with 2 threads
INFO: [Coretcl 2-168] The results of DRC are in file C:/Users/utilisateur/Desktop/LTspice/Porte logique/CoursFPGA/TP3_FSM/FSM.runs/impl_1/tp_fsm_drc_routed.rpt.
report_drc completed successfully
INFO: [runtcl-4] Executing : report_methodology -file tp_fsm_methodology_drc_routed.rpt -pb tp_fsm_methodology_drc_routed.pb -rpx tp_fsm_methodology_drc_routed.rpx
Command: report_methodology -file tp_fsm_methodology_drc_routed.rpt -pb tp_fsm_methodology_drc_routed.pb -rpx tp_fsm_methodology_drc_routed.rpx
INFO: [Timing 38-35] Done setting XDC timing constraints.
INFO: [DRC 23-133] Running Methodology with 2 threads
INFO: [Coretcl 2-1520] The results of Report Methodology are in file C:/Users/utilisateur/Desktop/LTspice/Porte logique/CoursFPGA/TP3_FSM/FSM.runs/impl_1/tp_fsm_methodology_drc_routed.rpt.
report_methodology completed successfully
INFO: [runtcl-4] Executing : report_power -file tp_fsm_power_routed.rpt -pb tp_fsm_power_summary_routed.pb -rpx tp_fsm_power_routed.rpx
Command: report_power -file tp_fsm_power_routed.rpt -pb tp_fsm_power_summary_routed.pb -rpx tp_fsm_power_routed.rpx
INFO: [Timing 38-35] Done setting XDC timing constraints.
Running Vector-less Activity Propagation...

Finished Running Vector-less Activity Propagation
96 Infos, 2 Warnings, 0 Critical Warnings and 0 Errors encountered.
report_power completed successfully
INFO: [runtcl-4] Executing : report_route_status -file tp_fsm_route_status.rpt -pb tp_fsm_route_status.pb
INFO: [runtcl-4] Executing : report_timing_summary -max_paths 10 -file tp_fsm_timing_summary_routed.rpt -pb tp_fsm_timing_summary_routed.pb -rpx tp_fsm_timing_summary_routed.rpx -warn_on_violation 
INFO: [Timing 38-91] UpdateTimingParams: Speed grade: -1, Delay Type: min_max.
INFO: [Timing 38-191] Multithreading enabled for timing update using a maximum of 2 CPUs
INFO: [runtcl-4] Executing : report_incremental_reuse -file tp_fsm_incremental_reuse_routed.rpt
INFO: [Vivado_Tcl 4-1062] Incremental flow is disabled. No incremental reuse Info to report.
INFO: [runtcl-4] Executing : report_clock_utilization -file tp_fsm_clock_utilization_routed.rpt
INFO: [runtcl-4] Executing : report_bus_skew -warn_on_violation -file tp_fsm_bus_skew_routed.rpt -pb tp_fsm_bus_skew_routed.pb -rpx tp_fsm_bus_skew_routed.rpx
INFO: [Timing 38-91] UpdateTimingParams: Speed grade: -1, Delay Type: min_max.
INFO: [Timing 38-191] Multithreading enabled for timing update using a maximum of 2 CPUs
INFO: [Common 17-206] Exiting Vivado at Fri May 19 06:59:05 2023...

*** Running vivado
    with args -log tp_fsm.vdi -applog -m64 -product Vivado -messageDb vivado.pb -mode batch -source tp_fsm.tcl -notrace



****** Vivado v2020.2 (64-bit)
  **** SW Build 3064766 on Wed Nov 18 09:12:45 MST 2020
  **** IP Build 3064653 on Wed Nov 18 14:17:31 MST 2020
    ** Copyright 1986-2020 Xilinx, Inc. All Rights Reserved.

source tp_fsm.tcl -notrace
Command: open_checkpoint tp_fsm_routed.dcp

Starting open_checkpoint Task

Time (s): cpu = 00:00:00 ; elapsed = 00:00:00.045 . Memory (MB): peak = 1145.742 ; gain = 0.000
INFO: [Device 21-403] Loading part xc7z010clg400-1
Netlist sorting complete. Time (s): cpu = 00:00:00 ; elapsed = 00:00:00.001 . Memory (MB): peak = 1145.742 ; gain = 0.000
INFO: [Netlist 29-17] Analyzing 7 Unisim elements for replacement
INFO: [Netlist 29-28] Unisim Transformation completed in 1 CPU seconds
INFO: [Project 1-479] Netlist was created with Vivado 2020.2
INFO: [Project 1-570] Preparing netlist for logic optimization
INFO: [Timing 38-478] Restoring timing data from binary archive.
INFO: [Timing 38-479] Binary timing data restore complete.
INFO: [Project 1-856] Restoring constraints from binary archive.
INFO: [Project 1-853] Binary constraint restore complete.
Reading XDEF placement.
Reading placer database...
Reading XDEF routing.
Read XDEF File: Time (s): cpu = 00:00:00 ; elapsed = 00:00:00.131 . Memory (MB): peak = 1556.109 ; gain = 9.121
Restored from archive | CPU: 0.000000 secs | Memory: 0.000000 MB |
Finished XDEF File Restore: Time (s): cpu = 00:00:00 ; elapsed = 00:00:00.131 . Memory (MB): peak = 1556.109 ; gain = 9.121
Netlist sorting complete. Time (s): cpu = 00:00:00 ; elapsed = 00:00:00 . Memory (MB): peak = 1556.109 ; gain = 0.000
INFO: [Project 1-111] Unisim Transformation Summary:
No Unisim elements were transformed.

INFO: [Project 1-604] Checkpoint was created with Vivado v2020.2 (64-bit) build 3064766
open_checkpoint: Time (s): cpu = 00:00:17 ; elapsed = 00:00:20 . Memory (MB): peak = 1556.109 ; gain = 410.367
Command: write_bitstream -force tp_fsm.bit
Attempting to get a license for feature 'Implementation' and/or device 'xc7z010'
INFO: [Common 17-349] Got license for feature 'Implementation' and/or device 'xc7z010'
Running DRC as a precondition to command write_bitstream
INFO: [IP_Flow 19-234] Refreshing IP repositories
INFO: [IP_Flow 19-1704] No user IP repositories specified
INFO: [IP_Flow 19-2313] Loaded Vivado IP repository 'E:/Vivado/2020.2/data/ip'.
INFO: [DRC 23-27] Running DRC with 2 threads
WARNING: [DRC PDRC-153] Gated clock check: Net uut/E[0] is a gated clock net sourced by a combinational pin uut/led_output_reg[2]_i_2/O, cell uut/led_output_reg[2]_i_2. This is not good design practice and will likely impact performance. For SLICE registers, for example, use the CE pin to control the loading of data.
WARNING: [DRC PDRC-153] Gated clock check: Net uut/counter_led_reg[0]_0[0] is a gated clock net sourced by a combinational pin uut/FSM_sequential_next_state_reg[1]_i_2/O, cell uut/FSM_sequential_next_state_reg[1]_i_2. This is not good design practice and will likely impact performance. For SLICE registers, for example, use the CE pin to control the loading of data.
WARNING: [DRC ZPS7-1] PS7 block required: The PS7 cell must be used in this Zynq design in order to enable correct default configuration.
INFO: [Vivado 12-3199] DRC finished with 0 Errors, 3 Warnings
INFO: [Vivado 12-3200] Please refer to the DRC report (report_drc) for more information.
INFO: [Designutils 20-2272] Running write_bitstream with 2 threads.
Loading data files...
Loading site data...
Loading route data...
Processing options...
Creating bitmap...
Creating bitstream...
Writing bitstream ./tp_fsm.bit...
INFO: [Vivado 12-1842] Bitgen Completed Successfully.
INFO: [Project 1-120] WebTalk data collection is mandatory when using a WebPACK part without a full Vivado license. To see the specific WebTalk data collected for your design, open the usage_statistics_webtalk.html or usage_statistics_webtalk.xml file in the implementation directory.
INFO: [Common 17-83] Releasing license: Implementation
22 Infos, 3 Warnings, 0 Critical Warnings and 0 Errors encountered.
write_bitstream completed successfully
write_bitstream: Time (s): cpu = 00:00:12 ; elapsed = 00:00:15 . Memory (MB): peak = 2032.879 ; gain = 476.770
INFO: [Common 17-206] Exiting Vivado at Fri May 19 07:00:18 2023...
